DiT_Anechoic_LibSp_conditional-masked-melspec_w-masked-pix=1/dit-net_dim768_depth18_heads12_dim-head64_dropout0.1_ff_mult2_T400_betaT0.02/repeat_all_freq-length=20_skip=50_cp=112000_mel_text=False_phoneme-without-space_g2p-no-nn_lm-weight=0p5_ctc-weight=0p1_bs=80/w1=1_w2=0.5_asr_start=320_mask=True/sample_500|10.0|4|40|the fancies of the neo platonists are only interesting to us because they exhibit a phase of the human mind which prevailed widely in the 1st centuries of the christian era and is not wholly extinct in our own day|the advances of neoplasts are only interesting to us because they exhibit a phase of the human mind which prevailed widely in the 1st centuries of the christian era and is not wholly extinct in our own day|1.4103|2.3303|3.4425|2.0475|2.2771|3.2116|2.3454|3.1633|2.692|3.0356|3.7118|4.067|2.5481|2.7747|2.5578|2.8072|3.3788|3.5806|2.8465|3.0515|3.5242|3.6037|2.7245|2.9192|3.7331|4.0624|2.5499|2.6266|2.5791|2.7251|3.3881|3.5778|2.8435|2.9213|3.536|3.6094|3.058|3.304|5.284|5.199|0.627|0.648|1.179|1.146|5.0|7.5|the fancies of the neoplatonists are only interesting to us because they exhibit a phase of the human mind which prevailed widely in the 1st centuries of the christian era and is not wholly extinct in our own day|the fancies of neoplatonists are only interesting to us because they exhibit a phase of the human mind which prevailed widely in the 1st centuries of the christian era and is not wholly extinct in our own day|2|3|40|40|3.213|3.318|1.358|1.494|0.847|0.847|1.801|1.816|2.5
DiT_Anechoic_LibSp_conditional-masked-melspec_w-masked-pix=1/dit-net_dim768_depth18_heads12_dim-head64_dropout0.1_ff_mult2_T400_betaT0.02/repeat_all_freq-length=20_skip=50_cp=112000_mel_text=False_phoneme-without-space_g2p-no-nn_lm-weight=0p5_ctc-weight=0p1_bs=80/w1=1_w2=0.5_asr_start=320_mask=True/sample_526|7.3171|3|41|but when it came to be a question of lighting a scattered suburb a group of dwellings on the outskirts a remote country residence or a farm house the alternating current in all elements save its danger was and is ideal|but when it came to be a question of lighting a scattered suburb a group of dwellings on the outskirts a remote country residence or a farmhouse the alternating current in all elements of its danger was and is ideal|1.7558|3.4226|3.6789|3.986|3.071|3.3598|3.9252|3.6003|3.8115|3.9488|4.042|4.1366|4.3082|4.4266|3.3134|3.3955|3.5668|3.6183|4.0902|4.1465|3.9388|4.0729|3.9218|4.0484|4.131|4.2705|4.3889|4.4302|3.3799|3.4526|3.6155|3.6872|4.1299|4.148|3.89|4.0147|4.255|4.233|5.146|5.116|0.653|0.661|1.135|1.129|7.317|7.317|but when it came to be a question of lighting a scattered suburb a group of dwellings on the outskirts a remote country residence or a farmhouse the alternating current in all elements of its danger was and is ideal|but when it came to be a question of lighting a scattered suburb a group of dwellings on the outskirts a remote country residence or a farmhouse the alternating current in all elements of its danger was and is ideal|3|3|41|41|4.468|4.271|1.356|1.502|0.903|0.897|1.743|1.733|7.3171
DiT_Anechoic_LibSp_conditional-masked-melspec_w-masked-pix=1/dit-net_dim768_depth18_heads12_dim-head64_dropout0.1_ff_mult2_T400_betaT0.02/repeat_all_freq-length=20_skip=50_cp=112000_mel_text=False_phoneme-without-space_g2p-no-nn_lm-weight=0p5_ctc-weight=0p1_bs=80/w1=1_w2=0.5_asr_start=320_mask=True/sample_603|19.5122|8|41|the fireball half of it white half azure blue and the size of a 10 inch shell moved slowly about the raft but revolving on its own axis with astonishing velocity as if whipped round by the force of the whirlwind|the fireball half of it white half a clear blue and the size of a 10 inch shell moving slowly above the raft but revolving on its own axis with a astonishing velocity and its whip round by the force of the whirlwind|1.5644|2.8774|3.4256|3.168|2.693|3.2007|3.3676|3.5493|3.4387|3.4509|3.8072|3.8275|3.8945|3.8559|3.0783|3.0883|3.4336|3.4465|3.8669|3.8484|4.0822|4.0653|3.4491|3.2855|3.7907|3.711|3.958|3.6353|3.0865|2.9775|3.425|3.3766|3.9055|3.7097|4.1446|4.0775|3.737|3.928|5.849|5.866|0.55|0.572|1.148|1.13|7.317|7.317|the fireball half of it wide half azure blue and the size of a 10 inch shell moves slowly about the raft but revolving on its own axis with astonishing velocity if whipped round by the force of the whirlwind|the fireball half of it wide half azure blue and the size of a 10 inch shell move slowly about the raft but revolving on its own axis with astonishing velocity if whipped round by the force of the whirlwind|3|3|41|41|3.672|3.922|1.41|1.546|0.888|0.885|1.844|1.727|9.7561
DiT_Anechoic_LibSp_conditional-masked-melspec_w-masked-pix=1/dit-net_dim768_depth18_heads12_dim-head64_dropout0.1_ff_mult2_T400_betaT0.02/repeat_all_freq-length=20_skip=50_cp=112000_mel_text=False_phoneme-without-space_g2p-no-nn_lm-weight=0p5_ctc-weight=0p1_bs=80/w1=1_w2=0.5_asr_start=320_mask=True/sample_1797|3.4483|1|29|it is by no means always reliable almost everybody has at some time experienced the well known illusion that all that is happening now happened before at some time|it is by no means always reliable almost everybody has at some time experienced the well known illusion that all that is happening now happens before at some time|2.036|3.0939|3.3621|3.8837|2.8487|3.1602|3.8649|3.7636|3.8051|3.7157|4.0889|3.9202|4.2054|4.2872|3.3107|3.2563|3.5931|3.5004|4.0425|4.0824|4.1393|4.2551|3.7086|3.7762|3.9734|3.9773|4.2115|4.3473|3.2522|3.2934|3.5304|3.5325|4.0455|4.111|4.104|4.2637|4.243|4.412|4.648|4.643|0.674|0.693|1.189|1.147|0.0|0.0|it is by no means always reliable almost everybody has at some time experienced the well known illusion that all that is happening now happened before at some time|it is by no means always reliable almost everybody has at some time experienced the well known illusion that all that is happening now happened before at some time|0|0|29|29|4.013|4.136|1.338|1.494|0.894|0.891|2.043|1.979|0.0
DiT_Anechoic_LibSp_conditional-masked-melspec_w-masked-pix=1/dit-net_dim768_depth18_heads12_dim-head64_dropout0.1_ff_mult2_T400_betaT0.02/repeat_all_freq-length=20_skip=50_cp=112000_mel_text=False_phoneme-without-space_g2p-no-nn_lm-weight=0p5_ctc-weight=0p1_bs=80/w1=1_w2=0.5_asr_start=320_mask=True/sample_1425|5.5556|2|36|it was a look so intelligent yet inexplicable perverse sometimes so malicious but generally accompanied by a wild flow of spirits that hester could not help questioning at such moments whether pearl was a human child|it was a look so intelligent yet inexplicable perverse sometimes so malicious generally accompanied by a wild flow of spirits that hester would not help questioning at such moments whether pearl was a human child|1.7121|2.9016|3.7237|2.9399|2.7126|3.3864|3.1903|3.0018|2.7375|2.9408|4.0765|4.0558|2.3904|2.6669|2.5911|2.7398|3.5861|3.5749|2.6943|2.9538|3.6178|3.4961|2.7608|2.994|4.124|4.1034|2.4093|2.6945|2.6091|2.7782|3.6116|3.6006|2.7145|2.9817|3.6859|3.4591|3.382|3.381|5.987|6.022|0.634|0.658|1.157|1.131|8.333|13.889|it caused a look so intelligent yet inexplicable perverse sometimes so malicious but generally accompanied by a wild flow of speedy arts that hester could not help questioning at such moments whether pearl was a human child|it also looked so intelligent yet inexplicable perverse sometimes so malicious but generally accompanied by a wild flow of speedy arts that hester could not help questioning at such moments whether pearl was a human child|3|5|36|36|3.327|3.426|1.327|1.438|0.869|0.864|1.578|1.547|0.0
DiT_Anechoic_LibSp_conditional-masked-melspec_w-masked-pix=1/dit-net_dim768_depth18_heads12_dim-head64_dropout0.1_ff_mult2_T400_betaT0.02/repeat_all_freq-length=20_skip=50_cp=112000_mel_text=False_phoneme-without-space_g2p-no-nn_lm-weight=0p5_ctc-weight=0p1_bs=80/w1=1_w2=0.5_asr_start=320_mask=True/sample_1061|4.0816|1|49|he had no friend wise enough to tell him to step into the dorking convention then in session make a sketch of the men and women on the platform and take it to the editor of the daily grapevine and see what he could get a line for it|he had no faggot wise enough to tell him to step into the dorking convention then in session make a sketch of the men and women on the platform and take it to the editor of the daily grapevine and see if he could get a line for it|1.4267|2.9931|3.1866|3.9758|2.7778|3.0411|3.9186|3.0666|3.5806|3.597|3.7414|3.7305|4.3131|4.4145|3.1714|3.1826|3.3961|3.3906|4.0926|4.1409|3.3121|3.3887|3.6086|3.3495|3.7727|3.5014|4.3057|4.2101|3.1882|3.0221|3.4139|3.2489|4.0884|4.0445|3.4259|3.3081|2.546|2.573|4.995|5.019|0.653|0.679|1.282|1.269|6.122|8.163|so he had no friend wise enough to tell him to step into the dorking convention then in session make a sketch of the men and women of the platform and take it to the editor of the daily grapevine and see if he could get a line for it|so he had no friend wise enough to tell him to step into the dorking convention then in session make a sketch of the men and women of the platform and take it to the editor of the daisy grapevine and see if he could get a line for it|3|3|49|49|2.546|2.394|1.579|1.701|0.881|0.883|1.737|1.745|6.1224
DiT_Anechoic_LibSp_conditional-masked-melspec_w-masked-pix=1/dit-net_dim768_depth18_heads12_dim-head64_dropout0.1_ff_mult2_T400_betaT0.02/repeat_all_freq-length=20_skip=50_cp=112000_mel_text=False_phoneme-without-space_g2p-no-nn_lm-weight=0p5_ctc-weight=0p1_bs=80/w1=1_w2=0.5_asr_start=320_mask=True/sample_1002|5.7143|2|35|one of his militia generals suggested that the governor should require the outlaws at lawrence and elsewhere to surrender the sharps rifles another wrote asking him to call out the government troops at fort leavenworth|one of his militia generals suggested that the governor should require the outlaws at lawrence and elsewhere to surrender the sharpest rifle another wrote asking him to call out the government troops at fort leavenworth|2.5095|3.3636|3.6397|3.9951|3.0319|3.3359|3.9279|3.6821|3.6378|3.8249|3.9905|4.0693|4.0277|4.282|3.208|3.3226|3.5397|3.5826|3.947|4.0798|4.0943|4.1396|3.7593|3.8853|4.0971|4.1352|4.0911|4.3032|3.2829|3.3583|3.5975|3.6175|3.9821|4.0899|4.0397|3.9737|4.2|4.383|5.02|5.01|0.637|0.652|1.164|1.143|5.714|5.714|one of his militia generals suggested that the governor should require the outlaws at lawrence and elsewhere to surrender the ship is rifles another wrote asking him to call out the government troops at fort leavenworth|one of his militia generals suggested that the governor should require the outlaws at lawrence and elsewhere to surrender the ship is rifles another wrote asking him to call out the government troops at fort leavenworth|2|2|35|35|4.124|4.21|1.423|1.554|0.897|0.899|1.84|1.868|5.7143
DiT_Anechoic_LibSp_conditional-masked-melspec_w-masked-pix=1/dit-net_dim768_depth18_heads12_dim-head64_dropout0.1_ff_mult2_T400_betaT0.02/repeat_all_freq-length=20_skip=50_cp=112000_mel_text=False_phoneme-without-space_g2p-no-nn_lm-weight=0p5_ctc-weight=0p1_bs=80/w1=1_w2=0.5_asr_start=320_mask=True/sample_847|12.5|2|16|quick quick then among the high reed grass said montalais stoop athenais you are so tall|quick quick then among the high reed grass said montagny stoop evgeny you are so tall|1.5433|3.408|3.6167|4.0878|3.0615|3.3221|3.9814|3.5642|3.7921|3.7604|4.1234|4.0066|4.1139|4.269|3.3029|3.2838|3.6113|3.5486|3.9952|4.0737|4.0422|4.2297|3.6608|3.606|4.1193|3.8837|3.916|4.1342|3.2227|3.1885|3.6093|3.48|3.8861|4.006|4.1208|4.1582|3.154|3.513|5.05|5.031|0.652|0.665|1.286|1.203|12.5|12.5|quick quick then among the high reed grass said montarti stoop eenie you are so tall|quick quick then among the high reed grass said montarti stoop etinay you are so tall|2|2|16|16|3.247|3.553|1.295|1.421|0.903|0.905|2.126|2.152|12.5
DiT_Anechoic_LibSp_conditional-masked-melspec_w-masked-pix=1/dit-net_dim768_depth18_heads12_dim-head64_dropout0.1_ff_mult2_T400_betaT0.02/repeat_all_freq-length=20_skip=50_cp=112000_mel_text=False_phoneme-without-space_g2p-no-nn_lm-weight=0p5_ctc-weight=0p1_bs=80/w1=1_w2=0.5_asr_start=320_mask=True/sample_275|5.1282|2|39|every line in which the master traces it even where seemingly negligent is lovely and set down with a meditative calmness which makes these 2 etchings capable of being placed beside the most tranquil work of holbein or duerer|every line in which the master traces it even where seemingly negligent is lovely and sat down with a meditative calmness which makes these 2 etchings capable of being placed beside the most tranquil work of holbein or durer|1.9469|3.1413|3.6678|3.313|2.8815|3.3532|3.483|3.5913|3.916|4.0555|4.1852|4.2758|4.3306|4.4464|3.3766|3.4567|3.6437|3.6899|4.1029|4.1552|4.1046|4.0824|3.8704|4.0463|4.1398|4.2772|4.2908|4.4089|3.3491|3.4516|3.6197|3.6905|4.083|4.1388|4.0702|4.09|4.233|4.373|5.218|5.196|0.659|0.673|1.176|1.14|10.256|10.256|the atriod line in which the master traces it even where seemingly negligent is lovely and set down with a meditative calmness which makes these 2 etchings capable of being placed beside the most tranquil work of hrudbain or durer|the every line in which the master traces it even where seemingly negligent is lovely and set down with a meditative calmness which makes these 2 etchings capable of being placed beside the most tranquil work of a kubine or durer|4|4|39|39|4.351|4.44|1.294|1.443|0.905|0.901|1.885|1.97|10.2564
DiT_Anechoic_LibSp_conditional-masked-melspec_w-masked-pix=1/dit-net_dim768_depth18_heads12_dim-head64_dropout0.1_ff_mult2_T400_betaT0.02/repeat_all_freq-length=20_skip=50_cp=112000_mel_text=False_phoneme-without-space_g2p-no-nn_lm-weight=0p5_ctc-weight=0p1_bs=80/w1=1_w2=0.5_asr_start=320_mask=True/sample_312|11.5385|3|26|she succeeded in opening the window and the moonlight shone in so brightly that she could distinguish the color of some damask hangings in the room|she succeeded in opening the window and the moonlight shone so brightly that she could distinguish the color of some desk hanging in the room|1.9802|3.5987|3.8884|4.1059|3.1828|3.4815|3.9877|3.8627|3.9753|3.8911|4.2464|4.1588|4.3592|4.2809|3.411|3.3618|3.6752|3.63|4.1165|4.0788|4.2029|4.2053|3.9049|3.7782|4.2079|4.0562|4.2837|4.2229|3.37|3.2946|3.6555|3.5756|4.0806|4.0509|4.146|4.1733|4.675|4.537|4.801|4.875|0.647|0.676|1.205|1.165|11.539|11.539|she is obseeded in opening the window and the moonlight shone in so brightly that she could distinguish the color of some damask hanging in the room|she is obceeded in opening the window and the moonlight shone in so brightly that she could distinguish the color of some damask hanging in the room|3|3|26|26|4.562|4.438|1.38|1.497|0.887|0.883|1.768|1.732|3.8462
DiT_Anechoic_LibSp_conditional-masked-melspec_w-masked-pix=1/dit-net_dim768_depth18_heads12_dim-head64_dropout0.1_ff_mult2_T400_betaT0.02/repeat_all_freq-length=20_skip=50_cp=112000_mel_text=False_phoneme-without-space_g2p-no-nn_lm-weight=0p5_ctc-weight=0p1_bs=80/w1=1_w2=0.5_asr_start=320_mask=True/sample_833|28.5714|6|21|to say nothing said montalais so that when mademoiselle de tonnay charente thinks athenais is the only one who knows it|to say nothing said antilay so that when god mozart tene sharon thinks athane is the only one who knows it|2.1694|3.9083|4.0735|4.4392|3.3719|3.5845|4.1521|3.7165|3.7819|4.0714|4.0642|4.2872|4.1732|4.4282|3.2968|3.4659|3.5799|3.6958|4.0259|4.1476|4.0409|4.1121|3.8282|3.7647|4.1158|4.0113|4.1767|4.2643|3.3242|3.2864|3.6072|3.5512|4.026|4.0715|4.0633|4.1156|3.976|4.29|5.038|5.04|0.679|0.711|1.255|1.227|23.809|23.809|to say nothing said montelay so that when mademoiselle saptone cheron thinks athene is the only one who knows it|to say nothing said montelay so that when mademoiselle saptenay cheron thinks athenay is the only one who knows it|5|5|21|21|3.992|4.281|1.332|1.485|0.916|0.916|1.972|1.93|28.5714
DiT_Anechoic_LibSp_conditional-masked-melspec_w-masked-pix=1/dit-net_dim768_depth18_heads12_dim-head64_dropout0.1_ff_mult2_T400_betaT0.02/repeat_all_freq-length=20_skip=50_cp=112000_mel_text=False_phoneme-without-space_g2p-no-nn_lm-weight=0p5_ctc-weight=0p1_bs=80/w1=1_w2=0.5_asr_start=320_mask=True/sample_5|20.0|6|30|a stage meal is popular because it proves to the audience that the actors even when called charles hawtrey or owen nares are real people just like you and me|a serial is popular because it is true to the audience that the actors even when called charles holstree or owen nairz are real people just like you and me|2.1311|3.842|4.0772|4.3229|3.3329|3.5869|4.0996|3.9029|4.0153|4.0478|4.2227|4.2|4.3632|4.5187|3.434|3.4526|3.6631|3.6515|4.1184|4.1867|4.3311|4.1324|3.9313|3.8884|4.1393|4.1057|4.3247|4.2772|3.3855|3.3604|3.6199|3.6021|4.1004|4.0778|4.2315|4.0169|4.286|4.179|4.935|4.941|0.721|0.737|1.219|1.184|6.667|6.667|a stage meal is popular because it proves to the audience that the actors even one called charles hultry or owen nares are real people just like you and me|a stage meal is popular because it proves to the audience that the actors even one called charles hultry or owen nares are real people just like you and me|2|2|30|30|4.213|4.183|1.321|1.452|0.914|0.917|1.818|1.809|10.0
DiT_Anechoic_LibSp_conditional-masked-melspec_w-masked-pix=1/dit-net_dim768_depth18_heads12_dim-head64_dropout0.1_ff_mult2_T400_betaT0.02/repeat_all_freq-length=20_skip=50_cp=112000_mel_text=False_phoneme-without-space_g2p-no-nn_lm-weight=0p5_ctc-weight=0p1_bs=80/w1=1_w2=0.5_asr_start=320_mask=True/sample_1784|9.0909|2|22|i come now to the other characteristic which memory images must have in order to account for our knowledge of the past|we will come now to the other characteristic which memory images must have in order to account for our knowledge of the past|2.2122|3.6041|3.8403|4.1943|3.1873|3.4552|4.0362|3.8132|3.8281|3.8047|4.1214|4.1122|4.1805|4.1147|3.3243|3.3105|3.6104|3.6055|4.0287|3.9956|4.007|4.0911|3.7506|3.9438|4.0522|4.1855|4.1369|4.3124|3.2778|3.3927|3.5734|3.6439|4.0071|4.0944|4.0512|4.1356|4.227|4.395|4.63|4.664|0.689|0.713|1.24|1.19|4.545|4.545|i come now to the other characteristics which memory images must have in order to account for our knowledge of the past|i come now to the other characteristics which memory images must have in order to account for our knowledge of the past|1|1|22|22|4.118|4.187|1.285|1.399|0.895|0.894|2.032|1.963|4.5455
DiT_Anechoic_LibSp_conditional-masked-melspec_w-masked-pix=1/dit-net_dim768_depth18_heads12_dim-head64_dropout0.1_ff_mult2_T400_betaT0.02/repeat_all_freq-length=20_skip=50_cp=112000_mel_text=False_phoneme-without-space_g2p-no-nn_lm-weight=0p5_ctc-weight=0p1_bs=80/w1=1_w2=0.5_asr_start=320_mask=True/sample_2061|20.8333|5|24|the princess sat down under a blue canopy with bouquets of roses and she let anders sit in a golden chair by her side|the princess sat down under a blue canopy with blue haze of roses and she and her seat in a golden chair by her side|1.7146|3.7894|4.0234|4.3514|3.3012|3.5576|4.1124|3.5677|3.7172|3.889|3.9561|4.0967|4.2592|4.4405|3.2574|3.3606|3.5207|3.5972|4.0689|4.1531|4.1664|4.0781|3.5264|3.6253|3.7275|3.8451|4.1784|4.23|3.1381|3.2005|3.389|3.458|4.0287|4.0544|3.9768|3.9764|4.416|4.257|4.991|4.961|0.589|0.597|1.174|1.128|16.667|16.667|the princess sat down under a blue canopy with bouquets of roses and she and her staff sat in a golden chair by her side|the princess sat down under a blue canopy with bouquets of roses and sheena and her stout in a golden chair by her side|4|4|24|24|4.171|3.828|1.418|1.538|0.826|0.821|1.444|1.472|12.5
DiT_Anechoic_LibSp_conditional-masked-melspec_w-masked-pix=1/dit-net_dim768_depth18_heads12_dim-head64_dropout0.1_ff_mult2_T400_betaT0.02/repeat_all_freq-length=20_skip=50_cp=112000_mel_text=False_phoneme-without-space_g2p-no-nn_lm-weight=0p5_ctc-weight=0p1_bs=80/w1=1_w2=0.5_asr_start=320_mask=True/sample_2410|14.2857|4|28|then i long tried by natural ills received the comfort fast while budding at thy sight my pilgrim is staff gave out green leaves with morning dews impearled|then i long tried by natural illness received the comfort fast while budding at thy sight my pilgrim staff gave out green leaves with morning dew imperiled|1.6959|3.103|3.4701|3.6408|2.8549|3.2299|3.7143|3.1259|3.8471|3.7141|4.1982|4.0436|4.1088|4.0919|3.3359|3.2554|3.6505|3.5685|3.9913|3.9832|3.685|3.791|3.7304|3.8705|4.1763|4.2082|3.8759|4.1784|3.2655|3.3496|3.639|3.6556|3.8576|4.0264|3.7722|3.9062|3.464|3.674|5.44|5.435|0.676|0.702|1.208|1.175|14.286|14.286|that i long tried by natural ills recede the comfort fast while budding at thy sight my pilgrim is staff dave out green leaves with morning dews imperiled|that i long tried by natural ills recede the comfort fast while budding at thy sight my pilgrim is staff dave out green leaves with morning dews imperiled|4|4|28|28|3.553|3.842|1.324|1.453|0.886|0.888|1.881|1.927|14.2857
DiT_Anechoic_LibSp_conditional-masked-melspec_w-masked-pix=1/dit-net_dim768_depth18_heads12_dim-head64_dropout0.1_ff_mult2_T400_betaT0.02/repeat_all_freq-length=20_skip=50_cp=112000_mel_text=False_phoneme-without-space_g2p-no-nn_lm-weight=0p5_ctc-weight=0p1_bs=80/w1=1_w2=0.5_asr_start=320_mask=True/sample_2096|6.0606|2|33|before any could stop him he butted his majesty so furiously that the king soared far into the air and tumbled in a heap among the benches where he lay moaning and groaning|before any could stop him he butted his majesty so furiously that the king soared far into the air and tumbled in a heap among the bitches where he lay mowing and groaning|1.9132|2.6274|3.1841|3.0847|2.5097|3.0412|3.3148|3.5205|3.9016|3.7616|4.1212|4.0538|4.3465|4.1402|3.3681|3.2845|3.6104|3.5743|4.1106|4.0092|3.9273|3.9691|3.6593|3.6182|3.994|3.9047|4.0117|4.0263|3.2218|3.1962|3.5417|3.4919|3.9404|3.9484|3.8802|3.9267|4.322|3.823|4.743|4.71|0.629|0.64|1.269|1.207|15.152|9.091|but for any could stop him he butted his majesty so furiously that the king saw him far into the air and tumbled in a heap among the beaches where he lay moaning and groaning|before any could stop him he butted his majesty so furiously that the king saw him far into the air and tumbled in a heap among the beaches where he lay moaning and groaning|5|3|33|33|4.385|4.034|1.386|1.469|0.876|0.877|1.787|1.762|9.0909
DiT_Anechoic_LibSp_conditional-masked-melspec_w-masked-pix=1/dit-net_dim768_depth18_heads12_dim-head64_dropout0.1_ff_mult2_T400_betaT0.02/repeat_all_freq-length=20_skip=50_cp=112000_mel_text=False_phoneme-without-space_g2p-no-nn_lm-weight=0p5_ctc-weight=0p1_bs=80/w1=1_w2=0.5_asr_start=320_mask=True/sample_494|5.8824|1|17|the ideas also remain but they have become types in nature forms of men animals birds fishes|the ideas also remain but they have become tied in nature forms of men animals birds fishes|1.8634|2.5767|3.529|2.4504|2.4707|3.267|2.7552|3.1928|3.4218|3.2783|4.2698|3.9958|3.2425|3.2504|3.0705|2.9755|3.687|3.5426|3.4363|3.4413|3.9157|3.7808|3.0381|2.8574|3.9543|3.7963|2.9635|2.744|2.8101|2.6803|3.5196|3.4295|3.2158|3.0262|3.9187|3.6868|3.755|3.739|5.179|5.136|0.555|0.566|1.194|1.163|0.0|0.0|the ideas also remain but they have become types in nature forms of men animals birds fishes|the ideas also remain but they have become types in nature forms of men animals birds fishes|0|0|17|17|3.539|3.585|1.263|1.394|0.863|0.86|1.993|1.998|0.0
DiT_Anechoic_LibSp_conditional-masked-melspec_w-masked-pix=1/dit-net_dim768_depth18_heads12_dim-head64_dropout0.1_ff_mult2_T400_betaT0.02/repeat_all_freq-length=20_skip=50_cp=112000_mel_text=False_phoneme-without-space_g2p-no-nn_lm-weight=0p5_ctc-weight=0p1_bs=80/w1=1_w2=0.5_asr_start=320_mask=True/sample_2423|35.1351|13|37|0 little cloud the virgin said i charge thee to tell me why thou complainest now when in one hour thou fade away then we shall seek thee but not find ah thel is like to thee|i charge thee to tell me why thou complainest now when in one hour thou fainth away then we shall seek thee but not find|2.0532|3.1741|3.5932|3.6193|2.9048|3.3076|3.7008|3.431|3.6546|3.7839|4.0669|4.1268|3.9402|4.1014|3.2186|3.2973|3.5811|3.6126|3.8993|3.9877|3.953|4.001|3.5178|3.6256|4.13|4.053|3.5318|3.9092|3.1318|3.2005|3.6148|3.5738|3.6326|3.8811|4.0639|3.9473|4.112|4.197|5.192|5.125|0.678|0.705|1.194|1.19|24.324|24.324|i charge thee to tell me why thou complainest thou when in one hour thou fade away then we shall seek thee do not find ah thou is like to thee|i charge thee to tell me why thou complainest thou when in one hour thou fade away then we shall seek thee do not find ah thou is like to thee|9|9|37|37|4.157|4.239|1.365|1.482|0.891|0.89|1.834|1.781|16.2162
DiT_Anechoic_LibSp_conditional-masked-melspec_w-masked-pix=1/dit-net_dim768_depth18_heads12_dim-head64_dropout0.1_ff_mult2_T400_betaT0.02/repeat_all_freq-length=20_skip=50_cp=112000_mel_text=False_phoneme-without-space_g2p-no-nn_lm-weight=0p5_ctc-weight=0p1_bs=80/w1=1_w2=0.5_asr_start=320_mask=True/sample_2401|12.0|3|25|lives not alone nor or itself fear not and i will call the weak worm from its lowly bed and thou shalt hear its voice|lives not alone nor of itself fear not i will call the weak worm from lowly bed and thou shalt hear its voice|1.8624|3.1142|3.6467|3.3815|2.8636|3.3406|3.5397|3.5135|3.7975|3.6885|4.1351|4.0927|4.1762|4.0235|3.3062|3.2398|3.6177|3.5952|4.0277|3.9469|3.7742|3.9285|3.523|3.6153|3.9254|3.9638|3.8569|4.0903|3.136|3.1944|3.5036|3.5251|3.8516|3.983|3.7043|3.8759|3.059|3.366|5.066|5.075|0.712|0.727|1.204|1.186|12.0|12.0|lives not alone nor of itself fear not and i will call the weak worm from slowly bed and thou shalt hear its voice|lives not alone nor of itself fear not and i will call the weak worm from slowly bed and thou shalt hear its voice|3|3|25|25|3.123|3.414|1.373|1.504|0.894|0.892|2.079|2.045|16.0
